{
  "id": 60,
  "publishDate": "2026-12-12",
  "difficulty": 5,
  "locale": "en",
  "prompt": "a beekeeper harvesting honey in a lavender field, art nouveau, no text, no letters, no watermark",
  "slots": {
    "who": {
      "answer": "beekeeper",
      "accepted": [
        "beekeeper",
        "bee keeper",
        "apiarist",
        "honey farmer"
      ],
      "hot": [
        "farmer",
        "gardener",
        "bee",
        "astronaut",
        "hazmat"
      ],
      "warm": [
        "woman",
        "man",
        "person",
        "worker",
        "suit",
        "veil",
        "honey"
      ]
    },
    "doing": {
      "answer": "harvesting honey",
      "accepted": [
        "harvesting honey",
        "collecting honey",
        "gathering honey",
        "honey",
        "harvesting"
      ],
      "hot": [
        "beekeeping",
        "holding a honeycomb",
        "honeycomb",
        "checking a hive",
        "collecting"
      ],
      "warm": [
        "working",
        "farming",
        "picking",
        "holding",
        "smoking",
        "bees",
        "gardening"
      ]
    },
    "where": {
      "answer": "lavender field",
      "accepted": [
        "lavender field",
        "lavender",
        "lavender farm",
        "field of lavender"
      ],
      "hot": [
        "flower field",
        "meadow",
        "field",
        "farm",
        "provence"
      ],
      "warm": [
        "garden",
        "flowers",
        "countryside",
        "purple",
        "hill",
        "summer",
        "france"
      ]
    },
    "style": {
      "answer": "art nouveau",
      "accepted": [
        "art nouveau",
        "nouveau",
        "mucha",
        "jugendstil"
      ],
      "hot": [
        "art deco",
        "poster",
        "decorative",
        "victorian",
        "vintage poster"
      ],
      "warm": [
        "vintage",
        "ornate",
        "floral",
        "illustration",
        "elegant",
        "retro",
        "old"
      ]
    }
  }
}
